symbol,name,Last Sale,Net Change,% Change,Market Cap,Country,IPO Year,Volume,Sector,Industry
JFBRW,Jeffs' Brands Ltd Warrant,$0.0129,-0.005,-27.933%,24289.00,Israel,2022,84719,Consumer Discretionary,Other Specialty Stores
JFIN,Jiayin Group Inc. American Depositary Shares,$10.27,-0.67,-6.124%,544643631.00,China,2019,220292,Finance,Finance: Consumer Services
JFU,9F Inc. American Depositary Shares,$1.07,0.01,0.943%,12597466.00,China,2019,1063,Finance,Finance: Consumer Services
JG,Aurora Mobile Limited American Depositary Shares,$8.02,-0.41,-4.864%,48730731.00,China,2018,41642,Technology,Computer Software: Programming Data Processing
JJSF,J & J Snack Foods Corp. Common Stock,$132.81,-0.13,-0.098%,2588500634.00,United States,1986,93740,Consumer Staples,Specialty Foods
JKHY,Jack Henry & Associates Inc. Common Stock,$171.88,-2.07,-1.19%,12529651691.00,United States,1985,487687,Technology,EDP Services
JL,J-Long Group Limited Ordinary Shares,$3.45,0.13,3.916%,10833000.00,Hong Kong,2024,34834,Consumer Discretionary,Clothing/Shoe/Accessory Stores
JMSB,John Marshall Bancorp Inc. Common Stock,$14.34,0.01,0.07%,204709838.00,United States,,25206,Finance,Major Banks
JNVR,Janover Inc. Common Stock,$72.08,-2.37,-3.183%,102963685.00,United States,2023,402662,Finance,Finance: Consumer Services
JOUT,Johnson Outdoors Inc. Class A Common Stock,$21.71,-0.34,-1.542%,224340806.00,United States,,43713,Consumer Discretionary,Recreational Games/Products/Toys
JOYY,JOYY Inc. American Depositary Shares,$40.26,-1.45,-3.476%,2450531992.00,Singapore,2012,700923,Technology,EDP Services
JRSH,Jerash Holdings (US) Inc. Common Stock,$2.82,-0.11,-3.754%,34671449.00,United States,2018,18073,Consumer Discretionary,Apparel
JRVR,James River Group Holdings Ltd. Common Shares,$4.30,0.06,1.415%,196270567.00,Bermuda,2014,268224,Finance,Property-Casualty Insurers
JSM,Navient Corporation 6% Senior Notes due December 15 2043,$17.07,0.07,0.412%,1745856492.00,United States,,12625,Finance,Investment Bankers/Brokers/Service
JSPR,Jasper Therapeutics Inc. Common Stock,$3.92,-0.31,-7.329%,58886718.00,United States,2020,119488,Health Care,Biotechnology: Biological Products (No Diagnostic Substances)
JTAI,Jet.AI Inc. Common Stock,$3.86,-0.21,-5.16%,8441824.00,United States,2021,44250,Consumer Discretionary,Transportation Services
JUNE,Junee Limited Ordinary Shares,$10.77,0.63,6.213%,140089203.00,Hong Kong,2024,45465,,
JUNS,Jupiter Neurosciences Inc. Common Stock,$0.7067,0.1267,21.845%,23394498.00,United States,2024,1253438,Health Care,Biotechnology: Pharmaceutical Preparations
JVA,Coffee Holding Co. Inc. Common Stock,$3.31,-0.11,-3.216%,18895463.00,United States,2005,80738,Consumer Staples,Packaged Foods
JVSAR,JV SPAC Acquisition Corp. Right,$0.23,0.00,0.00%,0.00,China,2024,192816,,
JWEL,Jowell Global Ltd. Ordinary Shares,$1.71,-0.07,-3.933%,3711512.00,China,2021,1139,Consumer Discretionary,Other Consumer Services
JXG,JX Luxventure Group Inc. Common Stock,$2.29,-0.02,-0.866%,3471177.00,China,2013,18209,Consumer Staples,Apparel
JYD,Jayud Global Logistics Limited Class A Ordinary Shares,$0.31,-0.0104,-3.246%,6619189.00,China,2023,1722454,Consumer Discretionary,Oil Refining/Marketing
JYNT,The Joint Corp. Common Stock,$10.02,-0.31,-3.001%,152052809.00,United States,2014,66162,Miscellaneous,Multi-Sector Companies
JZ,Jianzhi Education Technology Group Company Limited American Depositary Shs,$0.86,-0.0599,-6.512%,17359100.00,China,2022,31583,Real Estate,Other Consumer Services
JZXN,Jiuzi Holdings Inc. Ordinary Shares,$6.69,0.20,3.082%,73666192.00,China,2021,549073,Consumer Discretionary,Retail-Auto Dealers and Gas Stations
KALA,KALA BIO Inc. Common Stock,$3.47,-0.06,-1.70%,22389821.00,United States,2017,8467,Health Care,Biotechnology: Pharmaceutical Preparations
KALU,Kaiser Aluminum Corporation Common Stock,$54.45,-0.16,-0.293%,876670755.00,United States,,126439,Industrials,Metal Fabrications
KALV,KalVista Pharmaceuticals Inc. Common Stock,$11.745,-0.275,-2.288%,583910145.00,United Kingdom,2015,492177,Health Care,Biotechnology: Pharmaceutical Preparations
KARO,Karooooo Ltd. Ordinary Shares,$39.29,-0.94,-2.337%,1214061000.00,Singapore,2021,20424,Technology,Computer Software: Prepackaged Software
KAVL,Kaival Brands Innovations Group Inc. Common Stock,$0.4998,0.0201,4.19%,5768843.00,United States,,8654,Consumer Discretionary,Other Consumer Services
KBSX,FST Corp. Ordinary Shares,$2.04,0.01,0.493%,14671421.00,Taiwan,,63224,Consumer Discretionary,Recreational Games/Products/Toys
KC,Kingsoft Cloud Holdings Limited American Depositary Shares,$10.98,-2.22,-16.818%,2785468470.00,China,2020,11010678,Technology,Computer Software: Prepackaged Software
KDLY,Kindly MD Inc. Common Stock,$1.66,-0.04,-2.353%,10009216.00,United States,2024,22229,Health Care,Medical/Nursing Services
KDLYW,Kindly MD Inc. Warrants,$0.2658,0.00,0.00%,1602680.00,United States,2024,30,Health Care,Medical/Nursing Services
KDP,Keurig Dr Pepper Inc. Common Stock,$35.11,-0.28,-0.791%,47635523291.00,United States,,9609433,Consumer Staples,Beverages (Production/Distribution)
KE,Kimball Electronics Inc. Common Stock,$13.10,-0.32,-2.385%,321666085.00,United States,,85081,Technology,Electrical Products
KELYA,Kelly Services Inc. Class A Common Stock,$11.28,0.06,0.535%,393537159.00,United States,,280576,Consumer Discretionary,Professional Services
KELYB,Kelly Services Inc. Class B Common Stock,$11.43,0.00,0.00%,398770366.00,United States,,19,Consumer Discretionary,Professional Services
KEQU,Kewaunee Scientific Corporation Common Stock,$34.29,0.20,0.587%,97879571.00,United States,,12099,Industrials,Medical Specialities
KFFB,Kentucky First Federal Bancorp Common Stock,$2.75,-0.055,-1.961%,22238466.00,United States,2005,3129,Finance,Savings Institutions
KFII,K&F Growth Acquisition Corp. II Class A Ordinary shares,$9.97,0.00,0.00%,0.00,United States,2025,232121,,
KFIIU,K&F Growth Acquisition Corp. II Unit,$10.08,0.00,0.00%,0.00,United States,2025,208,Finance,Blank Checks
KGEI,Kolibri Global Energy Inc. Common stock,$7.20,0.31,4.499%,257298948.00,United States,,73401,Energy,Oil & Gas Production
KHC,The Kraft Heinz Company Common Stock,$28.81,-0.61,-2.073%,34427660546.00,United States,,8217942,Consumer Staples,Packaged Foods
KIDS,OrthoPediatrics Corp. Common Stock,$20.59,-0.38,-1.812%,500060888.00,United States,2017,129862,Health Care,Medical/Dental Instruments
KIDZ,Classover Holdings Inc. Class B Common Stock,$1.26,-0.12,-8.696%,15750000.00,United States,,617995,Real Estate,Other Consumer Services
KIDZW,Classover Holdings Inc. Warrants,$0.042,-0.003,-6.667%,525000.00,United States,,18693,,
KINS,Kingstone Companies Inc. Common Stock,$17.44,0.24,1.395%,239465187.00,United States,,369646,Finance,Property-Casualty Insurers
KIRK,Kirkland's Inc. COMMONSTOCK,$1.19,0.01,0.847%,15610351.00,United States,2002,142678,Consumer Discretionary,Other Specialty Stores
KITT,Nauticus Robotics Inc. Common stock,$0.94,-0.08,-7.843%,33045173.00,United States,2021,1182282,Industrials,Industrial Machinery/Components
KITTW,Nauticus Robotics Inc. Warrant,$0.0602,-0.0132,-17.984%,2116297.00,United States,2021,26028,Industrials,Industrial Machinery/Components
KLAC,KLA Corporation Common Stock,$642.19,-34.02,-5.031%,85338539414.00,United States,1980,2020845,Technology,Electronic Components
KLIC,Kulicke and Soffa Industries Inc. Common Stock,$29.30,-1.17,-3.84%,1564126822.00,Singapore,,805414,Technology,Semiconductors
KLRS,Kalaris Therapeutics Inc. Common Stock,$6.70,0.24,3.715%,125306167.00,United States,2020,109300,Health Care,Biotechnology: Biological Products (No Diagnostic Substances)
KLTO,Klotho Neurosciences Inc. Common Stock,$0.1672,-0.0088,-5.00%,4766978.00,United States,2022,61076,Health Care,Biotechnology: Biological Products (No Diagnostic Substances)
KLTOW,Klotho Neurosciences Inc. Warrant,$0.0187,0.0037,24.667%,533149.00,United States,2022,9549,Health Care,Biotechnology: Biological Products (No Diagnostic Substances)
KLTR,Kaltura Inc. Common Stock,$2.01,-0.02,-0.985%,309817919.00,United States,2021,567803,Technology,Computer Software: Prepackaged Software
KLXE,KLX Energy Services Holdings Inc. Common Stock,$1.65,-0.02,-1.198%,28715559.00,United States,,154336,Energy,Oilfield Services/Equipment
KMDA,Kamada Ltd. Ordinary Shares,$6.35,0.06,0.954%,365156947.00,Israel,2013,73841,Health Care,Biotechnology: Pharmaceutical Preparations
KMTS,Kestra Medical Technologies Ltd. Common Stock,$24.58,0.45,1.865%,1171273059.00,United States,2025,340491,Health Care,Medical/Dental Instruments
KNDI,Kandi Technologies Group Inc. Ordinary Shares,$1.15,-0.05,-4.167%,100461969.00,China,,68219,Consumer Discretionary,Auto Manufacturing
KNSA,Kiniksa Pharmaceuticals International plc Class A Ordinary Shares,$20.535,-0.685,-3.228%,1491749468.00,United States,2018,689397,Health Care,Biotechnology: Pharmaceutical Preparations
KOD,Kodiak Sciences Inc Common Stock,$2.36,0.05,2.165%,124486089.00,United States,2018,248512,Health Care,Biotechnology: Biological Products (No Diagnostic Substances)
KOPN,Kopin Corporation Common Stock,$0.8427,0.0109,1.31%,133821266.00,United States,1992,1622160,Technology,Semiconductors
KOSS,Koss Corporation Common Stock,$4.27,-0.24,-5.322%,40034645.00,United States,,21571,Consumer Staples,Consumer Electronics/Appliances
KPLT,Katapult Holdings Inc. Common Stock,$7.60,-0.18,-2.314%,33905447.00,United States,2019,10127,Consumer Discretionary,Diversified Commercial Services
KPLTW,Katapult Holdings Inc. Warrant,$0.0075,0.0013,20.968%,33459.00,United States,2019,2550,Consumer Discretionary,Diversified Commercial Services
KPRX,Kiora Pharmaceuticals Inc.  Common Stock,$2.75,-0.036,-1.292%,8252167.00,United States,,12759,Health Care,Biotechnology: Pharmaceutical Preparations
KPTI,Karyopharm Therapeutics Inc. Common Stock,$4.42,0.16,3.756%,37198738.00,United States,2013,93135,Health Care,Biotechnology: Pharmaceutical Preparations
KRKR,36Kr Holdings Inc. American Depositary Shares,$3.99,-0.12,-2.92%,7781637.00,China,2019,15604,Consumer Discretionary,Business Services
KRMD,KORU Medical Systems Inc. Common Stock (DE),$2.29,-0.11,-4.583%,105241793.00,United States,,35430,Health Care,Medical/Dental Instruments
KRNT,Kornit Digital Ltd. Ordinary Shares,$19.10,-0.21,-1.088%,865755307.00,Israel,2015,312576,Industrials,Industrial Machinery/Components
KRNY,Kearny Financial Corp Common Stock,$5.86,0.04,0.687%,378436942.00,United States,2005,256430,Finance,Savings Institutions
KRON,Kronos Bio Inc. Common Stock,$0.88,0.012,1.382%,53652908.00,United States,2020,74357,Health Care,Biotechnology: Pharmaceutical Preparations
KROS,Keros Therapeutics Inc. Common Stock,$13.53,0.44,3.361%,548804496.00,United States,2020,1255112,Health Care,Biotechnology: Pharmaceutical Preparations
KRRO,Korro Bio Inc. Common Stock,$13.46,0.06,0.448%,126374621.00,United States,2019,117777,Health Care,Biotechnology: Pharmaceutical Preparations
KRT,Karat Packaging Inc. Common Stock,$24.46,-0.47,-1.885%,490092912.00,United States,2021,35116,Industrials,Plastic Products
KRUS,Kura Sushi USA Inc. Class A Common Stock,$55.33,1.34,2.482%,668689000.00,United States,2019,422008,Consumer Discretionary,Restaurants
KRYS,Krystal Biotech Inc. Common Stock,$164.70,-4.43,-2.619%,4744361047.00,United States,2017,343020,Health Care,Biotechnology: Biological Products (No Diagnostic Substances)
KSCP,Knightscope Inc. Class A Common Stock,$4.48,0.23,5.412%,30917488.00,United States,2022,1236351,Telecommunications,Telecommunications Equipment
KSPI,Joint Stock Company Kaspi.kz American Depository Shares,$82.59,-3.66,-4.243%,15637050874.00,Kazakhstan,2024,258120,,
KTCC,Key Tronic Corporation Common Stock,$2.31,0.00,0.00%,24859922.00,United States,1983,11963,Technology,Electrical Products
KTOS,Kratos Defense & Security Solutions Inc. Common Stock,$33.27,0.31,0.941%,5085070208.00,United States,,1551844,Industrials,Military/Government/Technical
KTTA,Pasithea Therapeutics Corp. Common Stock,$1.37,0.05,3.788%,3706210.00,United States,2021,292133,Health Care,Biotechnology: Pharmaceutical Preparations
KTTAW,Pasithea Therapeutics Corp. Warrant,$0.0179,-0.002,-10.05%,48424.00,United States,2021,6500,Health Care,Biotechnology: Pharmaceutical Preparations
KURA,Kura Oncology Inc. Common Stock,$5.75,-0.28,-4.643%,464341026.00,United States,,1800239,Health Care,Biotechnology: Pharmaceutical Preparations
KVAC,Keen Vision Acquisition Corporation Ordinary Shares,$11.25,0.01,0.089%,0.00,United States,2023,5052,,
KVACW,Keen Vision Acquisition Corporation Warrant,$0.0498,0.0014,2.893%,0.00,United States,2023,2200,,
KVHI,KVH Industries Inc. Common Stock,$4.81,-0.08,-1.636%,95065071.00,United States,1996,15452,Technology,Radio And Television Broadcasting And Communications Equipment
KWE,KWESST Micro Systems Inc. Common Stock,$0.219,-0.0109,-4.741%,2439143.00,Canada,,131014,Technology,Computer Software: Prepackaged Software
KXIN,Kaixin Holdings Ordinary Shares,$0.9677,-0.0523,-5.127%,10599533.00,China,2017,23997,Consumer Discretionary,Retail-Auto Dealers and Gas Stations
KYMR,Kymera Therapeutics Inc. Common Stock,$25.02,-0.44,-1.728%,1624902283.00,United States,2020,718293,Health Care,Biotechnology: Biological Products (No Diagnostic Substances)
KYTX,Kyverna Therapeutics Inc. Common Stock,$1.83,-0.155,-7.809%,79083300.00,United States,2024,222489,Health Care,Biotechnology: Biological Products (No Diagnostic Substances)
KZIA,Kazia Therapeutics Limited American Depositary Shares,$0.7079,-0.0172,-2.372%,986697.00,Australia,,72834,Health Care,Biotechnology: Pharmaceutical Preparations
KZR,Kezar Life Sciences Inc. Common Stock,$4.06,-0.05,-1.217%,29661548.00,United States,2018,18606,Health Care,Biotechnology: Pharmaceutical Preparations
LAB,Standard BioTools Inc. Common Stock,$1.13,-0.02,-1.739%,428254589.00,United States,2011,726203,Industrials,Biotechnology: Laboratory Analytical Instruments
LAES,SEALSQ Corp Ordinary Shares,$2.43,-0.09,-3.571%,253956629.00,Switzerland,,2637282,Technology,Semiconductors
LAKE,Lakeland Industries Inc. Common Stock,$15.86,0.19,1.213%,117452879.00,United States,1986,73950,Health Care,Industrial Specialties
LAMR,Lamar Advertising Company Class A Common Stock,$107.03,-2.33,-2.131%,10959551766.00,United States,1996,776399,Real Estate,Real Estate Investment Trusts
LANC,Lancaster Colony Corporation Common Stock,$183.10,-1.66,-0.898%,5048433200.00,United States,,172919,Consumer Staples,Packaged Foods
LAND,Gladstone Land Corporation Common Stock,$9.48,-0.08,-0.837%,343030558.00,United States,2013,254548,Real Estate,Real Estate Investment Trusts
LANDM,Gladstone Land Corporation 5.00% Series D Cumulative Term Preferred Stock,$24.7299,0.0224,0.091%,894842974.00,United States,,4535,Real Estate,Real Estate Investment Trusts
LANDO,Gladstone Land Corporation 6.00% Series B Cumulative Redeemable Preferred Stock,$19.52,0.40,2.092%,706324524.00,United States,,21010,Real Estate,Real Estate Investment Trusts
LANDP,Gladstone Land Corporation 6.00% Series C Cumulative Redeemable Preferred Stock,$19.3899,0.389,2.047%,701616900.00,United States,,19869,Real Estate,Real Estate Investment Trusts
LARK,Landmark Bancorp Inc. Common Stock,$27.55,0.90,3.377%,159301235.00,United States,,21820,Finance,Major Banks
LASE,Laser Photonics Corporation Common Stock,$2.52,-0.12,-4.545%,34857635.00,United States,2022,78802,Miscellaneous,Industrial Machinery/Components
LASR,nLIGHT Inc. Common Stock,$7.12,-0.13,-1.793%,349100585.00,United States,2018,283076,Technology,Semiconductors
LAUR,Laureate Education Inc. Common Stock,$19.35,-0.02,-0.103%,2917686789.00,United States,2017,676124,Real Estate,Other Consumer Services
LAZR,Luminar Technologies Inc.  Class A Common Stock,$3.33,-0.36,-9.756%,141156026.00,United States,2019,2828336,Consumer Discretionary,Auto Parts:O.E.M.
LBGJ,Li Bang International Corporation Inc. Ordinary Shares,$1.25,0.05,4.167%,23150000.00,China,2024,8348,,
LBRDA,Liberty Broadband Corporation Class A Common Stock,$75.48,-2.84,-3.626%,10814940079.00,United States,,65043,Telecommunications,Cable & Other Pay Television Services
LBRDK,Liberty Broadband Corporation Class C Common Stock,$76.60,-2.40,-3.038%,10975416137.00,United States,,411533,Telecommunications,Cable & Other Pay Television Services
LBRDP,Liberty Broadband Corporation Series A Cumulative Redeemable Preferred Stock,$23.90,0.17,0.716%,3424444461.00,United States,,1501,Telecommunications,Cable & Other Pay Television Services
LBTYA,Liberty Global Ltd. Class A Common Shares,$10.48,-0.18,-1.689%,3654948868.00,United Kingdom,,1195249,Telecommunications,Cable & Other Pay Television Services
LBTYB,Liberty Global Ltd. Class B Common Shares,$10.14,0.00,0.00%,3536372283.00,United Kingdom,,75,Telecommunications,Cable & Other Pay Television Services
LBTYK,Liberty Global Ltd. Class C Common Shares,$10.87,-0.17,-1.54%,3790963187.00,United Kingdom,,767083,Telecommunications,Cable & Other Pay Television Services
LCFY,Locafy Limited Ordinary Share,$3.73,-0.27,-6.75%,5155550.00,Australia,2022,5872,Technology,Computer Software: Programming Data Processing
LCID,Lucid Group Inc. Common Stock,$2.31,-0.13,-5.328%,7002764656.00,United States,,73950892,Consumer Discretionary,Auto Manufacturing
LCNB,LCNB Corporation Common Stock,$14.12,0.05,0.355%,199910423.00,United States,,12115,Finance,Major Banks
LCUT,Lifetime Brands Inc. Common Stock,$3.81,-0.06,-1.55%,84440569.00,United States,1991,72945,Consumer Discretionary,Industrial Machinery/Components
LDTC,LeddarTech Holdings Inc. Common Shares,$0.387,0.0118,3.145%,11688823.00,United States,2021,71705,Technology,Computer Software: Prepackaged Software
LDTCW,LeddarTech Holdings Inc. Warrants,$0.0515,0.00,0.00%,1555489.00,United States,2021,39,Technology,Computer Software: Prepackaged Software
LDWY,Lendway Inc. Common Stock (DE),$3.74,0.00,0.00%,6618300.00,United States,,320,Consumer Discretionary,Advertising
LE,Lands' End Inc. Common Stock,$9.07,0.21,2.37%,280094543.00,United States,,149267,Consumer Discretionary,Clothing/Shoe/Accessory Stores
LECO,Lincoln Electric Holdings Inc. Common Shares,$177.29,-2.81,-1.56%,9945141410.00,United States,,260348,Industrials,Industrial Machinery/Components
LEDS,SemiLEDS Corporation Common Stock,$2.02,-0.08,-3.81%,16565953.00,Taiwan,2010,17377,Technology,Semiconductors
LEE,Lee Enterprises Incorporated Common Stock,$8.52,-0.13,-1.503%,52746800.00,United States,,16882,Consumer Discretionary,Newspapers/Magazines
LEGH,Legacy Housing Corporation Common Stock (TX),$24.09,0.03,0.125%,581276331.00,United States,2018,110099,Consumer Discretionary,Homebuilding
LEGN,Legend Biotech Corporation American Depositary Shares,$33.46,-0.28,-0.83%,6144900827.00,United States,2020,2608685,Health Care,Biotechnology: Pharmaceutical Preparations
LENZ,LENZ Therapeutics Inc. Common Stock,$23.06,-0.83,-3.474%,635138674.00,United States,2021,323286,Health Care,Biotechnology: Biological Products (No Diagnostic Substances)
LESL,Leslie's Inc. Common Stock,$0.5453,0.0088,1.64%,101004476.00,United States,2020,3263637,Consumer Discretionary,Other Specialty Stores
LEXX,Lexaria Bioscience Corp. Common Stock,$1.40,-0.03,-2.098%,24573632.00,Canada,,28931,Health Care,Biotechnology: Pharmaceutical Preparations
LFCR,Lifecore Biomedical Inc. Common Stock,$6.335,0.085,1.36%,234555472.00,United States,,238304,Health Care,Biotechnology: Pharmaceutical Preparations
LFMD,LifeMD Inc. Common Stock,$5.03,-0.13,-2.519%,224255951.00,United States,,484218,Health Care,Medical/Nursing Services
LFMDP,LifeMD Inc. 8.875% Series A Cumulative Perpetual Preferred Stock,$23.7701,0.0201,0.085%,1059758722.00,United States,,2907,Health Care,Medical/Nursing Services
LFST,LifeStance Health Group Inc. Common Stock,$6.71,-0.11,-1.613%,2580331520.00,United States,2021,855329,Health Care,Medical/Nursing Services
LFUS,Littelfuse Inc. Common Stock,$152.38,-2.96,-1.905%,3765777911.00,United States,,267296,Energy,Electrical Products
LFVN,Lifevantage Corporation Common Stock (Delaware),$14.185,-0.29,-2.003%,178039921.00,United States,,89544,Health Care,Biotechnology: Pharmaceutical Preparations
LFWD,Lifeward Ltd. Ordinary Shares,$1.39,-0.03,-2.113%,14776091.00,Israel,2014,49392,Health Care,Industrial Specialties
LGCB,Linkage Global Inc. Class A Ordinary Shares,$1.7201,-0.3199,-15.681%,6157958.00,Japan,2023,84740,Consumer Discretionary,Catalog/Specialty Distribution
LGCL,Lucas GC Limited Ordinary Shares,$0.3802,-0.01,-2.563%,30213375.00,China,2024,216911,Technology,Computer Software: Programming Data Processing
LGHL,Lion Group Holding Ltd. American Depositary Share,$2.96,-0.04,-1.333%,1594404.00,China,,246075,Finance,Investment Bankers/Brokers/Service
LGHLW,Lion Group Holding Ltd. Warrant,$0.006,-0.0004,-6.25%,3232.00,China,,1249,Finance,Investment Bankers/Brokers/Service
LGIH,LGI Homes Inc. Common Stock,$54.15,-1.35,-2.432%,1266951557.00,United States,2013,264513,Consumer Discretionary,Homebuilding
LGMK,LogicMark Inc. Common Stock (NV),$0.0097,-0.0023,-19.167%,587706.00,United States,,140642710,Health Care,Industrial Specialties
LGND,Ligand Pharmaceuticals Incorporated Common Stock,$104.62,-2.18,-2.041%,2014495031.00,United States,,77967,Health Care,Biotechnology: Pharmaceutical Preparations
LGO,Largo Inc. Common Shares,$1.49,-0.01,-0.667%,95526880.00,Canada,,108075,Industrials,Mining & Quarrying of Nonmetallic Minerals (No Fuels)
LGVN,Longeveron Inc. Class A Common Stock,$1.41,-0.05,-3.425%,21048343.00,United States,2021,60116,Health Care,Biotechnology: Pharmaceutical Preparations
LHSW,Lianhe Sowell International Group Ltd Ordinary Shares,$3.65,-0.34,-8.521%,189800000.00,China,2025,1304036,Technology,Computer Software: Prepackaged Software
LI,Li Auto Inc. American Depositary Shares,$22.73,-0.71,-3.029%,24054276985.00,China,2020,4646239,Consumer Discretionary,Auto Manufacturing
LICN,Lichen International Limited Class A Ordinary Shares,$3.16,-0.14,-4.242%,1893368.00,China,2023,25542,Consumer Discretionary,Professional Services
LIDR,AEye Inc. Class A Common Stock,$0.642,-0.0169,-2.565%,11998767.00,United States,2021,135648,Consumer Discretionary,Auto Parts:O.E.M.
LIDRW,AEye Inc. Warrant,$0.051,-0.0061,-10.683%,953173.00,United States,2021,15151,Consumer Discretionary,Auto Parts:O.E.M.
LIEN,Chicago Atlantic BDC Inc. Common Stock,$10.6889,0.2289,2.188%,243924824.00,United States,2022,6470,Finance,Finance: Consumer Services
LIF,Life360 Inc. Common Stock,$36.30,-0.72,-1.945%,2741660774.00,United States,2024,424489,,
LILA,Liberty Latin America Ltd. Class A Common Stock,$5.16,-0.05,-0.96%,1016004000.00,United States,,315682,Telecommunications,Cable & Other Pay Television Services
LILAK,Liberty Latin America Ltd. Class C Common Stock,$5.20,-0.04,-0.763%,1023880000.00,United States,,670569,Telecommunications,Cable & Other Pay Television Services
LIN,Linde plc Ordinary Shares,$447.99,-2.98,-0.661%,211859675748.00,United States,,1828949,Industrials,Major Chemicals
LINC,Lincoln Educational Services Corporation Common Stock,$17.20,-0.11,-0.635%,543396280.00,United States,2005,111497,Real Estate,Other Consumer Services
LIND,Lindblad Expeditions Holdings Inc. Common Stock,$7.92,-0.12,-1.493%,432324264.00,United States,2013,222583,Consumer Discretionary,Transportation Services
LINE,Lineage Inc. Common Stock,$54.885,0.885,1.639%,12524613366.00,United States,2024,488070,Real Estate,Real Estate Investment Trusts
LINK,Interlink Electronics Inc. Common Stock,$6.07,0.32,5.565%,59875779.00,United States,,3226,Technology,Computer peripheral equipment
LION,Lionsgate Studios Corp. Common Shares,$6.24,-0.19,-2.955%,1801370838.00,United States,,163436,Consumer Discretionary,Movies/Entertainment
LIPO,Lipella Pharmaceuticals Inc. Common Stock,$2.41,-0.02,-0.823%,6142635.00,United States,2022,2836,Health Care,Biotechnology: Pharmaceutical Preparations
LIQT,LiqTech International Inc. Common Stock,$1.48,-0.03,-1.987%,14216916.00,Denmark,,6750,Technology,Industrial Machinery/Components
LITE,Lumentum Holdings Inc. Common Stock,$52.21,-0.48,-0.911%,3612932000.00,United States,,2058879,Telecommunications,Telecommunications Equipment
LITM,Snow Lake Resources Ltd. Common Shares,$0.4513,-0.017,-3.63%,11628225.00,Canada,2021,1481691,Basic Materials,Other Metals and Minerals
LIVE,Live Ventures Incorporated Common Stock,$11.38,-0.32,-2.735%,35351185.00,United States,,202427,Consumer Discretionary,Other Specialty Stores
LIVN,LivaNova PLC Ordinary Shares,$35.07,0.27,0.776%,1906116399.00,United Kingdom,,498045,Health Care,Biotechnology: Electromedical & Electrotherapeutic Apparatus
LIXT,Lixte Biotechnology Holdings Inc. Common Stock,$1.226,-0.014,-1.129%,3290675.00,United States,,3798,Health Care,Biotechnology: Pharmaceutical Preparations
LKFN,Lakeland Financial Corporation Common Stock,$53.62,1.53,2.937%,1370311058.00,United States,,322213,Finance,Major Banks
LKQ,LKQ Corporation Common Stock,$41.38,-0.25,-0.601%,10723824962.00,United States,2003,1715151,Consumer Discretionary,Motor Vehicles
LLYVA,Liberty Media Corporation Series A Liberty Live Common Stock,$65.72,-1.70,-2.522%,6035315956.00,United States,,38565,Industrials,Broadcasting
LLYVK,Liberty Media Corporation Series C Liberty Live Common Stock,$66.98,-1.64,-2.39%,6151026517.00,United States,,208657,Industrials,Broadcasting
LMAT,LeMaitre Vascular Inc. Common Stock,$84.67,0.04,0.047%,1910039287.00,United States,2006,158938,Health Care,Medical/Dental Instruments
LMB,Limbach Holdings Inc. Common Stock,$85.16,5.28,6.61%,966853756.00,United States,,449448,Consumer Discretionary,Engineering & Construction
LMFA,LM Funding America Inc. Common Stock,$1.16,-0.03,-2.521%,5954758.00,United States,2015,30000,Finance,Finance: Consumer Services
LMNR,Limoneira Co Common Stock,$15.92,-0.01,-0.063%,287279090.00,United States,,57821,Consumer Staples,Farming/Seeds/Milling
LNKB,LINKBANCORP Inc. Common Stock,$6.43,0.07,1.101%,240336309.00,United States,,35756,Finance,Major Banks
