symbol,name,Last Sale,Net Change,% Change,Market Cap,Country,IPO Year,Volume,Sector,Industry
CTRN,Citi Trends Inc. Common Stock,$19.09,-0.50,-2.552%,166274358.00,United States,2005,38468,Consumer Discretionary,Clothing/Shoe/Accessory Stores
CTSH,Cognizant Technology Solutions Corporation Class A Common Stock,$70.01,-1.25,-1.754%,34628032135.00,United States,1998,3164255,Technology,EDP Services
CTSO,Cytosorbents Corporation Common Stock,$1.02,0.01,0.99%,63750000.00,United States,,31045,Health Care,Medical/Dental Instruments
CTXR,Citius Pharmaceuticals Inc. Common Stock,$0.989,-0.011,-1.10%,8498905.00,United States,,60399,Health Care,Biotechnology: Pharmaceutical Preparations
CUB,Lionheart Holdings Class A Ordinary Shares,$10.27,0.00,0.00%,326263276.00,United States,2024,30254,Industrials,Industrial Machinery/Components
CUBA,Herzfeld Caribbean Basin Fund Inc. (The) Common Stock,$2.44,0.00,0.00%,0.00,United States,,7139,Finance,Investment Managers
CUBWU,Lionheart Holdings Unit,$10.26,0.00,0.00%,0.00,United States,2024,1,Finance,Blank Checks
CUBWW,Lionheart Holdings Warrant,$0.13,0.00,0.00%,0.00,United States,2024,20,,
CUE,Cue Biopharma Inc. Common Stock,$0.779,-0.021,-2.625%,48157080.00,United States,2018,147773,Health Care,Biotechnology: Pharmaceutical Preparations
CUPR,Cuprina Holdings (Cayman) Limited Class A Ordinary Shares,$4.955,0.695,16.315%,107771250.00,Singapore,2025,260220,Consumer Discretionary,Military/Government/Technical
CURI,CuriosityStream Inc. Class A Common Stock,$2.91,0.29,11.069%,167691625.00,United States,2020,540381,Consumer Discretionary,Movies/Entertainment
CURIW,CuriosityStream Inc. Warrant,$0.02,0.0037,22.699%,1152520.00,United States,2020,616,Consumer Discretionary,Movies/Entertainment
CURR,Currenc Group Inc. Ordinary Shares,$1.47,-0.03,-2.00%,68396159.00,Singapore,,24584,Consumer Discretionary,Business Services
CVAC,CureVac N.V. Ordinary Shares,$3.20,-0.03,-0.929%,720498797.00,Germany,2020,508161,Health Care,Biotechnology: Pharmaceutical Preparations
CVBF,CVB Financial Corporation Common Stock,$17.47,0.21,1.217%,2439125010.00,United States,,1156099,Finance,Major Banks
CVCO,Cavco Industries Inc. Common Stock When Issued,$469.45,-6.10,-1.283%,3761772329.00,United States,,52450,Consumer Discretionary,Homebuilding
CVGI,Commercial Vehicle Group Inc. Common Stock,$0.86,0.0088,1.034%,29790773.00,United States,2004,389306,Consumer Discretionary,Auto Parts:O.E.M.
CVGW,Calavo Growers Inc. Common Stock,$24.66,0.56,2.324%,439848263.00,United States,,190974,Consumer Discretionary,Specialty Foods
CVKD,Cadrenal Therapeutics Inc. Common Stock,$16.20,-0.12,-0.735%,30451302.00,United States,2023,12049,Health Care,Biotechnology: Pharmaceutical Preparations
CVLT,Commvault Systems Inc. Common Stock,$151.06,-3.45,-2.233%,6646278362.00,United States,2006,357468,Technology,Computer Software: Prepackaged Software
CVRX,CVRx Inc. Common Stock,$6.15,-0.16,-2.536%,160121597.00,United States,2021,316383,Health Care,Medical/Dental Instruments
CVV,CVD Equipment Corporation Common Stock,$3.10,-0.07,-2.208%,21333698.00,United States,,4278,Technology,Industrial Machinery/Components
CWBC,Community West Bancshares Common Stock,$16.03,0.04,0.25%,305382913.00,United States,,35280,Finance,Major Banks
CWCO,Consolidated Water Co. Ltd. Ordinary Shares,$23.83,-0.20,-0.832%,378296389.00,Cayman Islands,,103528,Utilities,Water Supply
CWD,CaliberCos Inc. Class A Common Stock,$0.451,-0.049,-9.80%,10513880.00,United States,2023,385636,Finance,Real Estate
CWST,Casella Waste Systems Inc. Class A Common Stock,$117.96,-0.08,-0.068%,7473765711.00,United States,1997,1831958,Utilities,Environmental Services
CXAI,CXApp Inc. Class A Common Stock,$1.07,-0.06,-5.31%,21192189.00,United States,2021,685652,Technology,EDP Services
CXAIW,CXApp Inc. Warrant,$0.0966,-0.0004,-0.412%,1913239.00,United States,2021,43746,Technology,EDP Services
CXDO,Crexendo Inc. Common Stock,$4.49,-0.19,-4.06%,125275813.00,United States,,75400,Telecommunications,Telecommunications Equipment
CYBR,CyberArk Software Ltd. Ordinary Shares,$331.30,-3.03,-0.906%,16385671617.00,Israel,2014,685056,Technology,Computer Software: Prepackaged Software
CYCC,Cyclacel Pharmaceuticals Inc. Common Stock,$0.2164,-0.013,-5.667%,44867595.00,United States,,90763,Health Care,Biotechnology: Pharmaceutical Preparations
CYCN,Cyclerion Therapeutics Inc. Common Stock,$2.68,-0.01,-0.372%,7263057.00,United States,,3398,Health Care,Biotechnology: Pharmaceutical Preparations
CYCU,Cycurion Inc. Common Stock,$0.4161,-0.0611,-12.804%,4942306.00,United States,2025,1775512,Technology,EDP Services
CYCUW,Cycurion Inc. Warrant,$0.0473,0.0034,7.745%,561815.00,United States,2025,500,Technology,EDP Services
CYN,Cyngn Inc. Common Stock,$4.465,-0.005,-0.112%,7822260.00,United States,2021,26384,Technology,EDP Services
CYRX,CryoPort Inc. Common Stock,$5.61,-0.01,-0.178%,279997294.00,United States,,546647,Health Care,Biotechnology: Pharmaceutical Preparations
CYTK,Cytokinetics Incorporated Common Stock,$39.15,0.59,1.53%,4635778474.00,United States,2004,3004565,Health Care,Biotechnology: Pharmaceutical Preparations
CZFS,Citizens Financial Services Inc. Common Stock,$57.12,1.84,3.329%,271860984.00,United States,,9395,Finance,Major Banks
CZNC,Citizens & Northern Corp Common Stock,$18.76,-0.07,-0.372%,290143436.00,United States,,23184,Finance,Major Banks
CZR,Caesars Entertainment Inc. Common Stock,$24.75,-0.32,-1.276%,5247329324.00,United States,,4303505,Consumer Discretionary,Hotels/Resorts
CZWI,Citizens Community Bancorp Inc. Common Stock,$13.48,0.20,1.506%,134658945.00,United States,2006,11536,Finance,Savings Institutions
DADA,Dada Nexus Limited American Depositary Shares,$1.85,-0.02,-1.07%,477755383.00,China,2020,2805124,Technology,Computer Software: Programming Data Processing
DAIO,Data I/O Corporation Common Stock,$1.95,-0.06,-2.985%,18017475.00,United States,1981,83094,Industrials,Electrical Products
DAKT,Daktronics Inc. Common Stock,$12.36,-0.13,-1.041%,616681101.00,United States,1994,221932,Consumer Discretionary,Miscellaneous manufacturing industries
DALN,DallasNews Corporation Series A Common Stock,$4.55,0.37,8.852%,24353830.00,United States,,18125,Consumer Discretionary,Newspapers/Magazines
DARE,Dare Bioscience Inc. Common Stock,$2.91,-0.04,-1.356%,25754623.00,United States,2014,2033,Health Care,Biotechnology: Pharmaceutical Preparations
DASH,DoorDash Inc. Class A Common Stock,$179.39,-2.16,-1.19%,75361036509.00,United States,,3806731,Consumer Discretionary,Business Services
DATS,DatChat Inc. Common Stock,$2.26,-0.12,-5.042%,9664379.00,United States,2021,126267,Telecommunications,Telecommunications Equipment
DATSW,DatChat Inc. Series A Warrant,$0.2345,-0.0055,-2.292%,1002786.00,United States,2021,4118,Telecommunications,Telecommunications Equipment
DAVE,Dave Inc. Class A Common Stock,$82.17,-1.67,-1.992%,1075944087.00,United States,,289691,Finance,Finance: Consumer Services
DAVEW,Dave Inc. Warrants,$0.1697,0.0146,9.413%,2222073.00,United States,,13636,Finance,Finance: Consumer Services
DAWN,Day One Biopharmaceuticals Inc. Common Stock,$6.76,-0.43,-5.981%,685156528.00,United States,2021,1044816,Health Care,Biotechnology: Pharmaceutical Preparations
DBVT,DBV Technologies S.A. American Depositary Shares,$7.91,0.56,7.619%,216653112.00,France,2014,41142,Health Care,Biotechnology: Biological Products (No Diagnostic Substances)
DBX,Dropbox Inc. Class A Common Stock,$26.83,-0.10,-0.371%,8095964708.00,United States,2018,3320899,Technology,Computer Software: Prepackaged Software
DCBO,Docebo Inc. Common Shares,$29.16,-0.24,-0.816%,881533831.00,Canada,,42018,Technology,Computer Software: Prepackaged Software
DCGO,DocGo Inc. Common Stock,$2.19,-0.06,-2.667%,223341782.00,United States,2020,533241,Health Care,Medical/Nursing Services
DCOM,Dime Community Bancshares Inc. Common Stock,$25.37,0.19,0.755%,1107105574.00,United States,,243748,Finance,Major Banks
DCOMG,Dime Community Bancshares Inc. 9.000% Fixed-to-Floating Rate Subordinated Notes due 2034,$25.8799,0.3799,1.49%,1013162811.00,United States,,3435,Finance,Major Banks
DCOMP,Dime Community Bancshares Inc. Fixed-Rate Non-Cumulative Perpetual Preferred Stock Series A,$18.55,0.20,1.09%,809491856.00,United States,,1963,Finance,Major Banks
DCTH,Delcath Systems Inc. Common Stock,$11.55,0.15,1.316%,385806244.00,United States,,377684,Health Care,Medical/Dental Instruments
DDI,DoubleDown Interactive Co. Ltd. American Depository Shares,$10.17,0.03,0.296%,503958485.00,South Korea,2021,8833,Technology,EDP Services
DDOG,Datadog Inc. Class A Common Stock,$91.88,-0.67,-0.724%,31493157790.00,United States,2019,3467830,Technology,Computer Software: Prepackaged Software
DENN,Denny's Corporation Common Stock,$2.96,-0.05,-1.661%,152768755.00,United States,,788057,Consumer Discretionary,Restaurants
DERM,Journey Medical Corporation Common Stock,$6.21,0.03,0.485%,143478554.00,United States,2021,42108,Health Care,Biotechnology: Pharmaceutical Preparations
DEVS,DevvStream Corp. Common Stock,$0.2116,-0.0128,-5.704%,5997393.00,Canada,2024,117308,Finance,Finance/Investors Services
DFLI,Dragonfly Energy Holdings Corp. Common Stock (NV),$0.62,-0.027,-4.173%,4705578.00,United States,2021,121738,Miscellaneous,Industrial Machinery/Components
DFLIW,Dragonfly Energy Holdings Corp. Warrant,$0.0238,0.0009,3.93%,180633.00,United States,2021,38970,Miscellaneous,Industrial Machinery/Components
DGICA,Donegal Group Inc. Class A Common Stock,$18.14,-0.01,-0.055%,646488449.00,United States,,60394,Finance,Property-Casualty Insurers
DGICB,Donegal Group Inc. Class B Common Stock,$16.50,0.50,3.125%,588040761.00,United States,1986,246,Finance,Property-Casualty Insurers
DGII,Digi International Inc. Common Stock,$26.47,-0.10,-0.376%,976721559.00,United States,1989,227297,Telecommunications,Computer Communications Equipment
DGLY,Digital Ally Inc. Common Stock,$0.0264,-0.0029,-9.898%,146031.00,United States,,8946803,Technology,Radio And Television Broadcasting And Communications Equipment
DGNX,Diginex Limited Ordinary Shares,$121.00,-17.01,-12.325%,2806346950.00,Hong Kong,2025,55764,Technology,EDP Services
DGXX,Digi Power X Inc. Subordinate Voting Shares,$1.115,0.134,13.66%,40483275.00,Canada,,177331,Finance,Finance: Consumer Services
DH,Definitive Healthcare Corp. Class A Common Stock,$2.53,0.03,1.20%,285665652.00,United States,2021,538630,Technology,Computer Software: Prepackaged Software
DHAI,DIH Holdings US Inc. Class A Common Stock,$0.1755,-0.0055,-3.039%,8307521.00,United States,2024,574210,Health Care,Medical/Dental Instruments
DHAIW,DIH Holding US Inc. Warrants,$0.0155,-0.0011,-6.627%,733713.00,United States,2024,11333,Health Care,Medical/Dental Instruments
DHC,Diversified Healthcare Trust Common Shares of Beneficial Interest,$2.13,0.01,0.472%,513908727.00,United States,,697051,Real Estate,Real Estate Investment Trusts
DHCNI,Diversified Healthcare Trust 5.625% Senior Notes due 2042,$13.66,0.01,0.073%,3295771463.00,United States,,6400,Real Estate,Real Estate Investment Trusts
DHCNL,Diversified Healthcare Trust 6.25% Senior Notes Due 2046,$14.56,0.01,0.069%,3512915996.00,United States,,8839,Real Estate,Real Estate Investment Trusts
DHIL,Diamond Hill Investment Group Inc. Class A Common Stock,$129.82,-1.24,-0.946%,361872211.00,United States,,12658,Finance,Investment Managers
DIBS,1stdibs.com Inc. Common Stock,$2.38,-0.02,-0.833%,84257786.00,United States,2021,165485,Consumer Discretionary,Catalog/Specialty Distribution
DIOD,Diodes Incorporated Common Stock,$34.26,-1.36,-3.818%,1587400442.00,United States,,392621,Technology,Semiconductors
DIST,Distoken Acquisition Corporation Ordinary Shares,$11.69,0.44,3.911%,0.00,China,2023,3762,Finance,Blank Checks
DISTR,Distoken Acquisition Corporation Right,$0.27,0.05,22.727%,0.00,China,2023,75000,Finance,Blank Checks
DISTW,Distoken Acquisition Corporation Warrant,$0.0511,0.0211,70.333%,0.00,China,2023,274746,Finance,Blank Checks
DJCO,Daily Journal Corp. (S.C.) Common Stock,$382.00,-2.64,-0.686%,526176732.00,United States,,5281,Consumer Discretionary,Newspapers/Magazines
DJT,Trump Media & Technology Group Corp. Common Stock,$19.74,-0.22,-1.102%,4344090305.00,United States,2024,4516159,Technology,Computer Software: Programming Data Processing
DJTWW,Trump Media & Technology Group Corp. Warrants,$12.26,-0.485,-3.805%,2698001375.00,United States,2021,27099,Technology,Computer Software: Programming Data Processing
DKNG,DraftKings Inc. Class A Common Stock,$33.62,0.08,0.239%,16472328150.00,United States,2019,9763156,Consumer Discretionary,Services-Misc. Amusement & Recreation
DLHC,DLH Holdings Corp.,$3.49,0.75,27.372%,50208773.00,United States,,891607,Consumer Discretionary,Professional Services
DLO,DLocal Limited Class A Common Shares,$8.60,-0.10,-1.149%,2545528319.00,Uruguay,2021,373816,Consumer Discretionary,Business Services
DLPN,Dolphin Entertainment Inc. Common Stock,$1.02,-0.01,-0.971%,11391563.00,United States,,18363,Consumer Discretionary,Other Consumer Services
DLTH,Duluth Holdings Inc. Class B Common Stock,$1.70,-0.16,-8.602%,59735532.00,United States,2015,55556,Consumer Discretionary,Clothing/Shoe/Accessory Stores
DLTR,Dollar Tree Inc. Common Stock,$73.21,1.41,1.964%,15746227455.00,United States,1995,4628999,Consumer Discretionary,Department/Specialty Retail Stores
DMAA,Drugs Made In America Acquisition Corp. Ordinary Shares,$10.03,0.00,0.00%,0.00,United States,2025,1000,,
DMAAR,Drugs Made In America Acquisition Corp. Rights,$0.124,-0.006,-4.615%,0.00,United States,2025,1046,Finance,Blank Checks
DMAAU,Drugs Made In America Acquisition Corp. Units,$10.14,-0.01,-0.099%,0.00,United States,2025,1957,,
DMAC,DiaMedica Therapeutics Inc. Common Stock,$3.47,-0.04,-1.14%,148709140.00,United States,2018,84332,Health Care,Biotechnology: Pharmaceutical Preparations
DMLP,Dorchester Minerals L.P. Common Units Representing Limited Partnership Interests,$28.67,0.62,2.21%,1357230805.00,United States,,41427,Energy,Oil & Gas Production
DMN,Damon Inc. Common Stock,$0.0031,-0.0007,-18.421%,68296.00,United Kingdom,,478982424,Technology,EDP Services
DMRC,Digimarc Corporation Common Stock,$11.48,-0.48,-4.013%,247377687.00,United States,,155711,Technology,EDP Services
DNLI,Denali Therapeutics Inc. Common Stock,$12.55,-0.62,-4.708%,1822453157.00,United States,2017,1435100,Health Care,Biotechnology: Biological Products (No Diagnostic Substances)
DNTH,Dianthus Therapeutics Inc. Common Stock,$18.98,-0.23,-1.197%,609735897.00,United States,2018,228998,Health Care,Biotechnology: Pharmaceutical Preparations
DNUT,Krispy Kreme Inc. Common Stock,$3.98,-0.07,-1.728%,677794000.00,United States,2021,2670583,Consumer Staples,Food Chains
DOCU,DocuSign Inc. Common Stock,$76.39,-1.10,-1.42%,15468189711.00,United States,1989,2310464,Technology,Computer Software: Prepackaged Software
DOGZ,Dogness (International) Corporation Class A Common Stock,$16.95,-2.36,-12.222%,215784653.00,China,2017,52568,Consumer Discretionary,Miscellaneous manufacturing industries
DOMH,Dominari Holdings Inc. Common Stock,$3.85,-0.10,-2.532%,56379003.00,United States,,113270,Health Care,Biotechnology: Pharmaceutical Preparations
DOMO,Domo Inc. Class B Common Stock,$7.13,-1.10,-13.366%,284769248.00,United States,2018,307640,Technology,Computer Software: Prepackaged Software
DOOO,BRP Inc. (Recreational Products) Common Subordinate Voting Shares,$33.20,-0.96,-2.81%,2423937212.00,Canada,,193135,Consumer Discretionary,Industrial Specialties
DORM,Dorman Products Inc. Common Stock,$111.67,0.26,0.233%,3415043029.00,United States,,312807,Consumer Discretionary,Auto Parts:O.E.M.
DOX,Amdocs Limited Ordinary Shares,$83.28,-1.27,-1.502%,9401526170.00,Guernsey,,610310,Technology,EDP Services
DOYU,DouYu International Holdings Limited ADS,$6.38,-0.19,-2.892%,201834962.00,China,2019,55199,Technology,Computer Software: Programming Data Processing
DPRO,Draganfly Inc. Common Shares,$2.59,-0.06,-2.264%,10949989.00,Canada,,47732,Industrials,Aerospace
DPZ,Domino's Pizza Inc Common Stock,$462.25,-6.31,-1.347%,15853655122.00,United States,2004,368688,Consumer Discretionary,Food Distributors
DRCT,Direct Digital Holdings Inc. Class A Common Stock,$0.541,-0.0073,-1.331%,9620061.00,United States,2022,40498,Consumer Discretionary,Advertising
DRDB,Roman DBDR Acquisition Corp. II Ordinary shares,$10.0096,0.00,0.00%,0.00,United States,2025,81,,
DRIO,DarioHealth Corp. Common Stock,$0.70,-0.0038,-0.54%,29096911.00,Israel,,251520,Health Care,Medical/Dental Instruments
DRMA,Dermata Therapeutics Inc. Common Stock,$0.71,-0.0689,-8.846%,3855760.00,United States,2021,115466,Health Care,Biotechnology: Pharmaceutical Preparations
DRMAW,Dermata Therapeutics Inc. Warrant,$0.0234,0.0054,30.00%,127077.00,United States,2021,17918,Health Care,Biotechnology: Pharmaceutical Preparations
DRRX,DURECT Corporation Common Stock,$0.72,0.014,1.983%,22350226.00,United States,2000,15809,Health Care,Biotechnology: Pharmaceutical Preparations
DRS,Leonardo DRS Inc. Common Stock,$35.91,-0.40,-1.102%,9521812971.00,Israel,,722916,Industrials,Industrial Machinery/Components
DRTS,Alpha Tau Medical Ltd. Ordinary Shares,$2.53,-0.03,-1.172%,178062842.00,Israel,,11593,Health Care,Medical/Dental Instruments
DRTSW,Alpha Tau Medical Ltd. Warrant,$0.22,0.014,6.796%,15483725.00,Israel,,2402,Health Care,Medical/Dental Instruments
DRUG,Bright Minds Biosciences Inc. Common Stock,$32.01,-0.40,-1.234%,223717538.00,Canada,,16412,Health Care,Biotechnology: Pharmaceutical Preparations
DRVN,Driven Brands Holdings Inc. Common Stock,$16.16,-0.36,-2.179%,2647600102.00,United States,2021,522959,Consumer Discretionary,Automotive Aftermarket
DSGN,Design Therapeutics Inc. Common Stock,$3.38,0.06,1.807%,191857852.00,United States,2021,105105,Health Care,Biotechnology: Pharmaceutical Preparations
DSGR,Distribution Solutions Group Inc. Common Stock,$26.02,-1.01,-3.737%,1211462916.00,United States,,62684,Consumer Discretionary,Industrial Specialties
DSGX,Descartes Systems Group Inc. (The) Common Stock,$103.10,-0.48,-0.463%,8825975404.00,Canada,,289043,Technology,Computer Software: Prepackaged Software
DSP,Viant Technology Inc. Class A Common Stock,$12.75,-0.39,-2.968%,804190453.00,United States,2021,265383,Technology,Computer Software: Programming Data Processing
DSWL,Deswell Industries Inc. Common Shares,$2.258,-0.032,-1.397%,35981770.00,Macau,1995,9371,Industrials,Plastic Products
DSY,Big Tree Cloud Holdings Limited Ordinary Shares,$1.582,-0.018,-1.125%,90301424.00,China,,22143,Consumer Discretionary,Containers/Packaging
DSYWW,Big Tree Cloud Holdings Limited Warrants,$0.0189,-0.0001,-0.526%,1078822.00,China,,400,Consumer Discretionary,Containers/Packaging
DTCK,Davis Commodities Limited Ordinary Shares,$0.47,0.01,2.174%,11515294.00,Singapore,2023,5623,Industrials,Farming/Seeds/Milling
DTI,Drilling Tools International Corporation Common Stock,$1.82,-0.15,-7.614%,64778781.00,United States,2021,39876,Industrials,Metal Fabrications
DTIL,Precision BioSciences Inc. Common Stock,$5.01,-0.51,-9.239%,52514474.00,United States,2019,156145,Health Care,Biotechnology: Biological Products (No Diagnostic Substances)
DTSQ,DT Cloud Star Acquisition Corporation Ordinary Shares,$10.29,0.00,0.00%,0.00,United States,2024,4,,
DTSQR,DT Cloud Star Acquisition Corporation Right,$0.1002,-0.0156,-13.472%,0.00,United States,2024,44671,,
DTSS,Datasea Inc. Common Stock,$1.88,-0.07,-3.59%,14080076.00,China,,9585,Technology,Computer Software: Prepackaged Software
DTST,Data Storage Corporation Common Stock,$3.375,-0.175,-4.93%,23942523.00,United States,,21249,Technology,EDP Services
DTSTW,Data Storage Corporation Warrant,$0.29,0.00,0.00%,2057283.00,United States,,199,Technology,EDP Services
DUO,Fangdd Network Group Ltd. Class A Ordinary Shares,$0.2276,0.0048,2.154%,1449812.00,China,2019,2435043,Finance,Real Estate
DUOL,Duolingo Inc. Class A Common Stock,$326.40,1.23,0.378%,14767250573.00,United States,2021,569775,Technology,Computer Software: Prepackaged Software
DUOT,Duos Technologies Group Inc. Common Stock,$5.68,0.53,10.291%,65459416.00,United States,,154924,Technology,Computer Software: Prepackaged Software
DVAX,Dynavax Technologies Corporation Common Stock,$10.65,-0.76,-6.661%,1321354329.00,United States,2004,2693931,Health Care,Biotechnology: Pharmaceutical Preparations
DVLT,Datavault AI Inc. Common Stock,$0.7762,0.0262,3.493%,49834085.00,United States,2018,254343,Technology,Semiconductors
DWSN,Dawson Geophysical Company Common Stock,$1.15,-0.05,-4.167%,35630953.00,United States,,2325,Energy,Oil & Gas Production
DWTX,Dogwood Therapeutics Inc. Common Stock,$3.73,-0.43,-10.337%,7128507.00,United States,2020,720481,Health Care,Biotechnology: Pharmaceutical Preparations
DXCM,DexCom Inc. Common Stock,$68.73,-0.50,-0.722%,26857760797.00,United States,2005,4273569,Health Care,Medical/Dental Instruments
DXLG,Destination XL Group Inc. Common Stock,$0.9389,-0.0611,-6.11%,50254495.00,United States,,261570,Consumer Discretionary,Clothing/Shoe/Accessory Stores
DXPE,DXP Enterprises Inc. Common Stock,$79.57,-0.75,-0.934%,1248858152.00,United States,,108313,Industrials,Industrial Machinery/Components
DXR,Daxor Corporation Common Stock,$7.50,0.0137,0.183%,36300000.00,United States,,2042,Health Care,Medical/Dental Instruments
DXST,Decent Holding Inc Ordinary Shares,$1.07,-0.09,-7.759%,17387500.00,China,2025,9799,Industrials,Miscellaneous
DYAI,Dyadic International Inc. Common Stock,$1.24,0.01,0.813%,37312420.00,United States,,71840,Health Care,Biotechnology: Biological Products (No Diagnostic Substances)
DYN,Dyne Therapeutics Inc. Common Stock,$7.83,-0.02,-0.255%,885740225.00,United States,2020,1455086,Health Care,Biotechnology: Pharmaceutical Preparations
DYNX,Dynamix Corporation Class A Ordinary Shares,$9.96,0.00,0.00%,0.00,United States,2024,122,,
EA,Electronic Arts Inc. Common Stock,$142.97,-2.64,-1.813%,37260497414.00,United States,,2215855,Technology,Computer Software: Prepackaged Software
EBAY,eBay Inc. Common Stock,$65.47,-0.03,-0.046%,30509020000.00,United States,1998,7165674,Consumer Discretionary,Business Services
EBC,Eastern Bankshares Inc. Common Stock,$14.72,0.01,0.068%,3135246921.00,United States,2020,933315,Finance,Savings Institutions
EBMT,Eagle Bancorp Montana Inc. Common Stock,$16.18,-0.01,-0.062%,129070724.00,United States,2010,37591,Finance,Major Banks
EBON,Ebang International Holdings Inc. Class A Ordinary Shares,$3.36,0.03,0.901%,21987632.00,China,2020,11887,Technology,Semiconductors
EBTC,Enterprise Bancorp Inc Common Stock,$34.88,0.13,0.374%,434569257.00,United States,,19345,Finance,Major Banks
ECBK,ECB Bancorp Inc. Common Stock,$15.20,0.13,0.863%,137663573.00,United States,2022,28612,Finance,Banks
ECDA,ECD Automotive Design Inc. Common Stock,$0.4994,-0.0406,-7.519%,17671600.00,United States,2022,6184,Consumer Discretionary,Auto Manufacturing
ECOR,electroCore Inc. Common Stock,$5.98,-0.23,-3.704%,43014690.00,United States,2018,67442,Health Care,Biotechnology: Electromedical & Electrotherapeutic Apparatus
ECPG,Encore Capital Group Inc Common Stock,$29.51,-0.41,-1.37%,699129997.00,United States,,260321,Finance,Finance Companies
ECX,ECARX Holdings Inc. Class A Ordinary shares,$0.948,0.0332,3.629%,327752065.00,China,,18266881,Technology,EDP Services
ECXWW,ECARX Holdings Inc. Warrants,$0.0476,0.0104,27.957%,16456749.00,China,,216671,Technology,EDP Services
EDAP,EDAP TMS S.A. American Depositary Shares,$1.31,-0.05,-3.676%,48983633.00,France,1997,146943,Health Care,Biotechnology: Electromedical & Electrotherapeutic Apparatus
EDBL,Edible Garden AG Incorporated Common Stock,$1.86,-0.0801,-4.129%,2672325.00,United States,2022,54164,Consumer Staples,Farming/Seeds/Milling
EDBLW,Edible Garden AG Incorporated Warrant,$0.0417,-0.0061,-12.762%,59912.00,United States,2022,13966,Consumer Staples,Farming/Seeds/Milling
EDIT,Editas Medicine Inc. Common Stock,$1.27,-0.08,-5.926%,105379881.00,United States,2016,1286212,Health Care,Biotechnology: Biological Products (No Diagnostic Substances)
EDRY,EuroDry Ltd. Common Shares ,$8.72,0.13,1.513%,24698676.00,Greece,,2973,Consumer Discretionary,Marine Transportation
EDSA,Edesa Biotech Inc. Common Shares,$2.34,0.079,3.494%,7598890.00,United States,,17553,Health Care,Biotechnology: Pharmaceutical Preparations
EDTK,Skillful Craftsman Education Technology Limited Ordinary Share,$0.97,-0.03,-3.00%,15451567.00,China,2020,1614,Real Estate,Other Consumer Services
EDUC,Educational Development Corporation Common Stock,$1.16,-0.01,-0.855%,9956977.00,United States,,4617,Consumer Discretionary,Consumer Specialties
EEFT,Euronet Worldwide Inc. Common Stock,$94.38,-1.55,-1.616%,4128421114.00,United States,1997,346208,Finance,Investment Bankers/Brokers/Service
EEIQ,EpicQuest Education Group International Limited Common Stock,$0.6695,0.0072,1.087%,8903127.00,United States,2021,1949,Real Estate,Other Consumer Services
EFOI,Energy Focus Inc. Common Stock,$1.71,0.01,0.588%,8995867.00,United States,,4402,Consumer Discretionary,Building Products
EFSC,Enterprise Financial Services Corporation Common Stock,$48.05,0.32,0.67%,1776859017.00,United States,,141932,Finance,Major Banks
EFSCP,Enterprise Financial Services Corporation Depositary Shares Each Representing a 1/40th Interest in a Share of 5% Fixed Rate Non-Cumulative Perpetual Preferred Stock Series A,$17.50,-0.02,-0.114%,647139080.00,United States,,879,Finance,Major Banks
EFSI,Eagle Financial Services Inc Common Stock,$31.00,-0.10,-0.322%,166738243.00,United States,,21058,Finance,Major Banks
EGAN,eGain Corporation Common Stock,$4.66,-0.11,-2.306%,131090087.00,United States,1999,32077,Technology,Computer Software: Prepackaged Software
EGBN,Eagle Bancorp Inc. Common Stock,$20.10,0.13,0.651%,607104460.00,United States,,510315,Finance,Major Banks
EGHT,8x8 Inc Common Stock,$1.64,-0.07,-4.094%,215977620.00,United States,,941623,Technology,EDP Services
